slot	class	aliases	annotations	aev	apu	ao	comments	description	examples	identifier	in_subset	maximum_value	minimum_value	mixin	multivalued	notes	pattern	range	recommended	required	slot_uri	string_serialization	structured_pattern	title	todos
root_med_suppl	PlantAssociatedInterface	rooting medium organic supplements		supplement name;measurement value	milligram per liter	1		Organic supplements of the culture rooting medium, such as vitamins, amino acids, organic acids, antibiotics activated charcoal; e.g. nicotinic acid (0.5¬†mg/L).	nicotinic acid;0.5 milligram per liter						false		^[^;\t\r\x0A\|]+;[-+]?[0-9]*\.?[0-9]+([eE][-+]?[0-9]+)? [^;\t\r\x0A\|]+$	string			MIXS:0000580	{text};{float} {unit}		rooting medium organic supplements	
salinity	PlantAssociatedInterface	salinity		measurement value	practical salinity unit, percentage	1		The total concentration of all dissolved salts in a liquid or solid sample. While salinity can be measured by a complete chemical analysis, this method is difficult and time consuming. More often, it is instead derived from the conductivity measurement. This is known as practical salinity. These derivations compare the specific conductance of the sample to a salinity standard such as seawater.	25 practical salinity unit						false		^[-+]?[0-9]*\.?[0-9]+ +\S.*$	string			MIXS:0000183			salinity	
salt_regm	PlantAssociatedInterface	salt regimen		salt name;salt amount;treatment interval and duration	gram, microgram, mole per liter, gram per liter	m		Information about treatment involving use of salts as supplement to liquid and soil growth media; should include the name of salt, amount administered, treatment regimen including how many times the treatment was repeated, how long each treatment lasted, and the start and end time of the entire treatment; can include multiple salt regimens	NaCl;5 gram per liter;R2/2018-05-11T14:30/2018-05-11T19:30/P1H30M						false			string			MIXS:0000582	{text};{float} {unit};{Rn/start_time/end_time/duration}		salt regimen	
samp_capt_status	PlantAssociatedInterface	sample capture status		enumeration		1		Reason for the sample	farm sample						false			samp_capt_status_enum			MIXS:0000860			sample capture status	
samp_collec_device	PlantAssociatedInterface	sample collection device		device name			Report dimensions and details when applicable	The device used to collect an environmental sample. This field accepts terms listed under environmental sampling device (http://purl.obolibrary.org/obo/ENVO). This field also accepts terms listed under specimen collection device (http://purl.obolibrary.org/obo/GENEPIO_0002094).	swab, biopsy, niskin bottle, push core, drag swab [GENEPIO:0002713]						false			string	true		MIXS:0000002	{termLabel} {[termID]}|{text}		sample collection device	
samp_collec_method	PlantAssociatedInterface	sample collection method		PMID,DOI,url , or text			This can be a citation or description	The method employed for collecting the sample.	swabbing						false			string			MIXS:0001225	{PMID}|{DOI}|{URL}|{text}		sample collection method	
samp_dis_stage	PlantAssociatedInterface	sample disease stage		enumeration		1		Stage of the disease at the time of sample collection, e.g. inoculation, penetration, infection, growth and reproduction, dissemination of pathogen.	infection						false			samp_dis_stage_enum			MIXS:0000249			sample disease stage	
samp_mat_process	PlantAssociatedInterface	sample material processing		text				A brief description of any processing applied to the sample during or after retrieving the sample from environment, or a link to the relevant protocol(s) performed.	filtering of seawater|storing samples in ethanol						false			string			MIXS:0000016	{text}		sample material processing	
samp_size	PlantAssociatedInterface	amount or size of sample collected		measurement value	millliter, gram, milligram, liter		This refers to the TOTAL amount of sample collected from the experiment. NOT the amount sent to each institution or collected for a specific analysis.	The total amount or size (volume (ml), mass (g) or area (m2) ) of sample collected.	5 grams|10 mL						false		^[-+]?[0-9]*\.?[0-9]+([eE][-+]?[0-9]+)? \S+$	string			MIXS:0000001	{float} {unit}		amount or size of sample collected	
samp_store_dur	PlantAssociatedInterface	sample storage duration		duration		1		Duration for which the sample was stored	P1Y6M						false			string			MIXS:0000116	{duration}		sample storage duration	
samp_store_loc	PlantAssociatedInterface	sample storage location		location name		1		Location at which sample was stored, usually name of a specific freezer/room	Freezer no:5						false			string			MIXS:0000755	{text}		sample storage location	
samp_store_temp	PlantAssociatedInterface	sample storage temperature		measurement value	degree Celsius	1		Temperature at which the sample was stored (degrees are assumed)	-80 Celsius						false		^[-+]?[0-9]*\.?[0-9]+ +\S.*$	string		true	MIXS:0000110			sample storage temperature	
sample_link	PlantAssociatedInterface						This field allows multiple entries separated by ; (Examples: Soil collected from the field will link with the soil used in an incubation. The soil a plant was grown in links to the plant sample. An original culture sample was transferred to a new vial and generated a new sample)	A unique identifier to assign parent-child, subsample, or sibling samples. This is relevant when a sample or other material was used to generate the new sample.	IGSN:DSJ0284						false	"also tempted to include SampIdNewTermsMixin but if len(slot_usage.keys()) > 1 and ""placeholder"" in slot_usage.keys():AttributeError: 'list' object has no attribute 'keys'"	[^\:\n\r]+\:[^\:\n\r]+	string	true			{text}:{text}		sample linkage	
season_environment	PlantAssociatedInterface	seasonal environment		seasonal environment name;treatment interval and duration		m		Treatment involving an exposure to a particular season (e.g. Winter, summer, rabi, rainy etc.), treatment regimen including how many times the treatment was repeated, how long each treatment lasted, and the start and end time of the entire treatment	rainy;R2/2018-05-11T14:30/2018-05-11T19:30/P1H30M						false			string			MIXS:0001068	{text};{Rn/start_time/end_time/duration}		seasonal environment	
size_frac	PlantAssociatedInterface	size fraction selected		filter size value range				Filtering pore size used in sample preparation	0-0.22 micrometer						false			string			MIXS:0000017	{float}-{float} {unit}		size fraction selected	
specific_ecosystem	PlantAssociatedInterface						Specific ecosystems help to define samples based on very specific characteristics of an environment under the five-level classification system.	Specific ecosystems represent specific features of the environment like aphotic zone in an ocean or gastric mucosa within a host digestive system. Specific ecosystem is in position 5/5 in a GOLD path.							false	string or SpecificEcosystemEnum range?		string	true						
standing_water_regm	PlantAssociatedInterface	standing water regimen		standing water type;treatment interval and duration		m		Treatment involving an exposure to standing water during a plant's life span, types can be flood water or standing water, treatment regimen including how many times the treatment was repeated, how long each treatment lasted, and the start and end time of the entire treatment; can include multiple regimens	standing water;R2/2018-05-11T14:30/2018-05-11T19:30/P1H30M						false			string			MIXS:0001069	{text};{Rn/start_time/end_time/duration}		standing water regimen	
temp	PlantAssociatedInterface	temperature		measurement value	degree Celsius			Temperature of the sample at the time of sampling.	25 degree Celsius						false		^[-+]?[0-9]*\.?[0-9]+ +\S.*$	string			MIXS:0000113			temperature	
tiss_cult_growth_med	PlantAssociatedInterface	tissue culture growth media		PMID,DOI,url or free text		1		Description of plant tissue culture growth media used	https://link.springer.com/content/pdf/10.1007/BF02796489.pdf						false			string			MIXS:0001070	{PMID}|{DOI}|{URL}|{text}		tissue culture growth media	
water_temp_regm	PlantAssociatedInterface	water temperature regimen		measurement value;treatment interval and duration	degree Celsius	m		Information about treatment involving an exposure to water with varying degree of temperature, treatment regimen including how many times the treatment was repeated, how long each treatment lasted, and the start and end time of the entire treatment; can include multiple regimens	15 degree Celsius;R2/2018-05-11T14:30/2018-05-11T19:30/P1H30M						false			string			MIXS:0000590	{float} {unit};{Rn/start_time/end_time/duration}		water temperature regimen	
watering_regm	PlantAssociatedInterface							Information about treatment involving an exposure to watering frequencies, treatment regimen including how many times the treatment was repeated, how long each treatment lasted, and the start and end time of the entire treatment; can include multiple regimens	1 liter;R2/2018-05-11T14:30/2018-05-11T19:30/P1H30M|75% water holding capacity; constant						false			string	true		MIXS:0000591	{float} {unit};{Rn/start_time/end_time/duration}		watering regimen	
	SedimentInterface							sediment dh_interface																Sediment	
alkalinity	SedimentInterface	alkalinity		measurement value	milliequivalent per liter, milligram per liter	1		Alkalinity, the ability of a solution to neutralize acids to the equivalence point of carbonate or bicarbonate	50 milligram per liter						false		^[-+]?[0-9]*\.?[0-9]+ +\S.*$	string			MIXS:0000421			alkalinity	
alkyl_diethers	SedimentInterface	alkyl diethers		measurement value	mole per liter	1		Concentration of alkyl diethers	0.005 mole per liter						false		^[-+]?[0-9]*\.?[0-9]+ +\S.*$	string			MIXS:0000490			alkyl diethers	
aminopept_act	SedimentInterface	aminopeptidase activity		measurement value	mole per liter per hour	1		Measurement of aminopeptidase activity	0.269 mole per liter per hour						false		^[-+]?[0-9]*\.?[0-9]+ +\S.*$	string			MIXS:0000172			aminopeptidase activity	
ammonium	SedimentInterface	ammonium		measurement value	micromole per liter, milligram per liter, parts per million	1		Concentration of ammonium in the sample	1.5 milligram per liter						false		^[-+]?[0-9]*\.?[0-9]+ +\S.*$	string			MIXS:0000427			ammonium	
bacteria_carb_prod	SedimentInterface	bacterial carbon production		measurement value	nanogram per hour	1		Measurement of bacterial carbon production	2.53 microgram per liter per hour						false		^[-+]?[0-9]*\.?[0-9]+ +\S.*$	string			MIXS:0000173			bacterial carbon production	
biomass	SedimentInterface	biomass		biomass type;measurement value	ton, kilogram, gram	m		Amount of biomass; should include the name for the part of biomass measured, e.g. Microbial, total. Can include multiple measurements	total;20 gram						false		^([^;\t\r\x0A]+;[-+]?[0-9]*\.?[0-9]+([eE][-+]?[0-9]+)? [^;\t\r\x0A]+\|)*([^;\t\r\x0A]+;[-+]?[0-9]*\.?[0-9]+([eE][-+]?[0-9]+)? [^;\t\r\x0A]+)$	string			MIXS:0000174	{text};{float} {unit}		biomass	
bishomohopanol	SedimentInterface	bishomohopanol		measurement value	microgram per liter, microgram per gram	1		Concentration of bishomohopanol	14 microgram per liter						false		^[-+]?[0-9]*\.?[0-9]+ +\S.*$	string			MIXS:0000175			bishomohopanol	
bromide	SedimentInterface	bromide		measurement value	parts per million	1		Concentration of bromide	0.05 parts per million						false		^[-+]?[0-9]*\.?[0-9]+ +\S.*$	string			MIXS:0000176			bromide	
calcium	SedimentInterface	calcium		measurement value	milligram per liter, micromole per liter, parts per million	1		Concentration of calcium in the sample	0.2 micromole per liter						false		^[-+]?[0-9]*\.?[0-9]+ +\S.*$	string			MIXS:0000432			calcium	
carb_nitro_ratio	SedimentInterface	carbon/nitrogen ratio		measurement value		1		Ratio of amount or concentrations of carbon to nitrogen	0.417361111						false		^[-+]?[0-9]*\.?[0-9]+ +\S.*$	float			MIXS:0000310			carbon/nitrogen ratio	
chem_administration	SedimentInterface	chemical administration		CHEBI;timestamp		m		List of chemical compounds administered to the host or site where sampling occurred, and when (e.g. Antibiotics, n fertilizer, air filter); can include multiple compounds. For chemical entities of biological interest ontology (chebi) (v 163), http://purl.bioontology.org/ontology/chebi	agar [CHEBI:2509];2018-05-11|agar [CHEBI:2509];2018-05-22|agar [CHEBI:2509];2018-05						false		^\S+.*\S+ \[[a-zA-Z]{2,}:\d+\];([\+-]?\d{4}(?!\d{2}\b))((-?)((0[1-9]|1[0-2])(\3([12]\d|0[1-9]|3[01]))?|W([0-4]\d|5[0-2])(-?[1-7])?|(00[1-9]|0[1-9]\d|[12]\d{2}|3([0-5]\d|6[1-6])))([T\s]((([01]\d|2[0-3])((:?)[0-5]\d)?|24\:?00)([\.,]\d+(?!:))?)?(\17[0-5]\d([\.,]\d+)?)?([zZ]|([\+-])([01]\d|2[0-3]):?([0-5]\d)?)?)?)?$	string	true		MIXS:0000751	{termLabel} {[termID]};{timestamp}		chemical administration	
chloride	SedimentInterface	chloride		measurement value	milligram per liter, parts per million	1		Concentration of chloride in the sample	5000 milligram per liter						false		^[-+]?[0-9]*\.?[0-9]+ +\S.*$	string			MIXS:0000429			chloride	
chlorophyll	SedimentInterface	chlorophyll		measurement value	milligram per cubic meter, microgram per liter	1		Concentration of chlorophyll	5 milligram per cubic meter						false		^[-+]?[0-9]*\.?[0-9]+ +\S.*$	string			MIXS:0000177			chlorophyll	
collection_date	SedimentInterface	collection date		date and time				The date of sampling	2021-04-15|2021-04|2021						false	MIxS collection_date accepts (truncated) ISO8601. DH taking arb prec date only|Use modified term (amended definition)	^[12]\d{3}(?:(?:-(?:0[1-9]|1[0-2]))(?:-(?:0[1-9]|[12]\d|3[01]))?)?$	string		true	MIXS:0000011	{date, arbitrary precision}		collection date	
density	SedimentInterface	density		measurement value	gram per cubic meter, gram per cubic centimeter	1		Density of the sample, which is its mass per unit volume (aka volumetric mass density)	1000 kilogram per cubic meter						false		^[-+]?[0-9]*\.?[0-9]+ +\S.*$	string			MIXS:0000435			density	
depth	SedimentInterface	depth		measurement value			All depths must be reported in meters. Provide the numerical portion only.	The vertical distance below local surface, e.g. for sediment or soil samples depth is measured from sediment or soil surface, respectively. Depth can be reported as an interval for subsurface samples.	0 - 0.1|1						false	Use modified term	^[-+]?[0-9]*\.?[0-9]+([eE][-+]?[0-9]+)?(\s*-\s*[-+]?[0-9]*\.?[0-9]+([eE][-+]?[0-9]+)?)?$	string		true	MIXS:0000018	{float}|{float}-{float}		depth, meters	
diether_lipids	SedimentInterface	diether lipids		diether lipid name;measurement value	nanogram per liter	m		Concentration of diether lipids; can include multiple types of diether lipids	0.2 nanogram per liter						false		^([^;\t\r\x0A]+;[-+]?[0-9]*\.?[0-9]+([eE][-+]?[0-9]+)? [^;\t\r\x0A]+\|)*([^;\t\r\x0A]+;[-+]?[0-9]*\.?[0-9]+([eE][-+]?[0-9]+)? [^;\t\r\x0A]+)$	string			MIXS:0000178	{text};{float} {unit}		diether lipids	
diss_carb_dioxide	SedimentInterface	dissolved carbon dioxide		measurement value	micromole per liter, milligram per liter	1		Concentration of dissolved carbon dioxide in the sample or liquid portion of the sample	5 milligram per liter						false		^[-+]?[0-9]*\.?[0-9]+ +\S.*$	string			MIXS:0000436			dissolved carbon dioxide	
diss_hydrogen	SedimentInterface	dissolved hydrogen		measurement value	micromole per liter	1		Concentration of dissolved hydrogen	0.3 micromole per liter						false		^[-+]?[0-9]*\.?[0-9]+ +\S.*$	string			MIXS:0000179			dissolved hydrogen	
diss_inorg_carb	SedimentInterface	dissolved inorganic carbon		measurement value	microgram per liter, milligram per liter, parts per million	1		Dissolved inorganic carbon concentration in the sample, typically measured after filtering the sample using a 0.45 micrometer filter	2059 micromole per kilogram						false		^[-+]?[0-9]*\.?[0-9]+ +\S.*$	string			MIXS:0000434			dissolved inorganic carbon	
diss_org_carb	SedimentInterface	dissolved organic carbon		measurement value	micromole per liter, milligram per liter	1		Concentration of dissolved organic carbon in the sample, liquid portion of the sample, or aqueous phase of the fluid	197 micromole per liter						false		^[-+]?[0-9]*\.?[0-9]+ +\S.*$	string			MIXS:0000433			dissolved organic carbon	
diss_org_nitro	SedimentInterface	dissolved organic nitrogen		measurement value	microgram per liter, milligram per liter	1		Dissolved organic nitrogen concentration measured as; total dissolved nitrogen - NH4 - NO3 - NO2	0.05 micromole per liter						false		^[-+]?[0-9]*\.?[0-9]+ +\S.*$	string			MIXS:0000162			dissolved organic nitrogen	
diss_oxygen	SedimentInterface	dissolved oxygen		measurement value	micromole per kilogram, milligram per liter	1		Concentration of dissolved oxygen	175 micromole per kilogram						false		^[-+]?[0-9]*\.?[0-9]+ +\S.*$	string			MIXS:0000119			dissolved oxygen	
ecosystem	SedimentInterface						The abiotic factors play a profound role on the type and composition of organisms in a given environment. The GOLD Ecosystem at the top of the five-level classification system is aimed at capturing the broader environment from which an organism or environmental sample is collected. The three broad groups under Ecosystem are Environmental, Host-associated, and Engineered. They represent samples collected from a natural environment or from another organism or from engineered environments like bioreactors respectively.	An ecosystem is a combination of a physical environment (abiotic factors) and all the organisms (biotic factors) that interact with this environment. Ecosystem is in position 1/5 in a GOLD path.							false	range: string or EcosystemEnum? The enum could be dynamic or might be soil biased.		string	true						
ecosystem_category	SedimentInterface						The Environmental ecosystem (for example) is divided into Air, Aquatic and Terrestrial. Ecosystem categories for Host-associated samples can be individual hosts or phyla and for engineered samples it may be manipulated environments like bioreactors, solid waste etc.	Ecosystem categories represent divisions within the ecosystem based on specific characteristics of the environment from where an organism or sample is isolated. Ecosystem category is in position 2/5 in a GOLD path.							false	string or EcosystemCategoryEnum range?		string	true						
ecosystem_subtype	SedimentInterface						Ecosystem Type Marine (Environmental -> Aquatic -> Marine) is further divided (for example) into Intertidal zone, Coastal, Pelagic, Intertidal zone etc. in the Ecosystem subtype category.	Ecosystem subtypes represent further subdivision of Ecosystem types into more distinct subtypes. Ecosystem subtype is in position 4/5 in a GOLD path.							false	string or EcosystemSubtypeEnum range?		string	true						
ecosystem_type	SedimentInterface						The Aquatic ecosystem category (for example) may have ecosystem types like Marine or Thermal springs etc. Ecosystem category Air may have Indoor air or Outdoor air as different Ecosystem Types. In the case of Host-associated samples, ecosystem type can represent Respiratory system, Digestive system, Roots etc.	Ecosystem types represent things having common characteristics within the Ecosystem Category. These common characteristics based grouping is still broad but specific to the characteristics of a given environment. Ecosystem type is in position 3/5 in a GOLD path.							false	string or EcosystemTypeEnum range?		string	true						
elev	SedimentInterface						All elevations must be reported in meters. Provide the numerical portion only.	Elevation of the sampling site is its height above a fixed reference point, most commonly the mean sea level. Elevation is mainly used when referring to points on the earth's surface, while altitude is used for points above the surface, such as an aircraft in flight or a spacecraft in orbit.	225|0|1250						false			float		true	MIXS:0000093			elevation, meters	
env_broad_scale	SedimentInterface							In this field, report which major environmental system your sample or specimen came from. The systems identified should have a coarse spatial grain, to provide the general environmental context of where the sampling was done (e.g. were you in the desert or a rainforest?). We recommend using subclasses of ENVO's biome class: http://purl.obolibrary.org/obo/ENVO_00000428. Format (one term): termLabel [termID], Format (multiple terms): termLabel [termID]|termLabel [termID]|termLabel [termID]. Example: Annotating a water sample from the photic zone in middle of the Atlantic Ocean, consider: oceanic epipelagic zone biome [ENVO:01000033]. Example: Annotating a sample from the Amazon rainforest consider: tropical moist broadleaf forest biome [ENVO:01000228]. If needed, request new terms on the ENVO tracker, identified here: http://www.obofoundry.org/ontology/envo.html							false	"range changed to enumeration late in makefile, so this is modified (but ""sample ID"" anyway)"	^\S+.*\S+ \[[a-zA-Z]{2,}:\d+\]$	string		true	MIXS:0000012	{termLabel} {[termID]}		broad-scale environmental context	
env_local_scale	SedimentInterface							Report the entity or entities which are in the sample or specimen’s local vicinity and which you believe have significant causal influences on your sample or specimen. We recommend using EnvO terms which are of smaller spatial grain than your entry for env_broad_scale. Terms, such as anatomical sites, from other OBO Library ontologies which interoperate with EnvO (e.g. UBERON) are accepted in this field. EnvO documentation about how to use the field: https://github.com/EnvironmentOntology/envo/wiki/Using-ENVO-with-MIxS.	canopy [ENVO:00000047]|herb and fern layer [ENVO:01000337]|litter layer [ENVO:01000338]|understory [01000335]|shrub layer [ENVO:01000336]						false	"range changed to enumeration late in makefile, so this is modified (but ""sample ID"" anyway)"	^\S+.*\S+ \[[a-zA-Z]{2,}:\d+\]$	string		true	MIXS:0000013	{termLabel} {[termID]}		local environmental context	
env_medium	SedimentInterface							Report the environmental material(s) immediately surrounding the sample or specimen at the time of sampling. We recommend using subclasses of 'environmental material' (http://purl.obolibrary.org/obo/ENVO_00010483). EnvO documentation about how to use the field: https://github.com/EnvironmentOntology/envo/wiki/Using-ENVO-with-MIxS . Terms from other OBO ontologies are permissible as long as they reference mass/volume nouns (e.g. air, water, blood) and not discrete, countable entities (e.g. a tree, a leaf, a table top).	soil [ENVO:00001998]						false	"range changed to enumeration late in makefile, so this is modified (but ""sample ID"" anyway)"	^\S+.*\S+ \[[a-zA-Z]{2,}:\d+\]$	string		true	MIXS:0000014	{termLabel} {[termID]}		environmental medium	
env_package	SedimentInterface	environmental package						Select the MIxS enviromental package that best describes the environment from which your sample was collected.	soil		mixs extension				false			string		true				environmental package	
experimental_factor	SedimentInterface	experimental factor		text or EFO and/or OBI				Experimental factors are essentially the variable aspects of an experiment design which can be used to describe an experiment, or set of experiments, in an increasingly detailed manner. This field accepts ontology terms from Experimental Factor Ontology (EFO) and/or Ontology for Biomedical Investigations (OBI). For a browser of EFO (v 2.95) terms, please see http://purl.bioontology.org/ontology/EFO; for a browser of OBI (v 2018-02-12) terms please see http://purl.bioontology.org/ontology/OBI	time series design [EFO:EFO_0001779]						false			string			MIXS:0000008	{termLabel} {[termID]}|{text}		experimental factor	
geo_loc_name	SedimentInterface	geographic location (country and/or sea,region)		country or sea name (INSDC or GAZ): region(GAZ), specific location name				The geographical origin of the sample as defined by the country or sea name followed by specific region name.	USA: Maryland, Bethesda						false		^[^:, ][^:]*: [^:, ][^,]*, [^:, ].*$	string		true	MIXS:0000010	{text}: {text}, {text}		geographic location (country and/or sea,region)	
glucosidase_act	SedimentInterface	glucosidase activity		measurement value	mol per liter per hour	1		Measurement of glucosidase activity	5 mol per liter per hour						false		^[-+]?[0-9]*\.?[0-9]+ +\S.*$	string			MIXS:0000137			glucosidase activity	
horizon_meth	SedimentInterface	soil horizon method		PMID,DOI or url		1		Reference or method used in determining the horizon							false			string			MIXS:0000321	{PMID}|{DOI}|{URL}		horizon method	
lat_lon	SedimentInterface							This is currently a required field but it's not clear if this should be required for human hosts							false	required where?|This is currently a required field but it's not clear if this should be required for human hosts	^[-+]?([1-8]?\d(\.\d+)?|90(\.0+)?)\s[-+]?(180(\.0+)?|((1[0-7]\d)|([1-9]?\d))(\.\d+)?)$	string		true	MIXS:0000009	{lat lon}		geographic location (latitude and longitude)	
magnesium	SedimentInterface	magnesium		measurement value	mole per liter, milligram per liter, parts per million, micromole per kilogram	1		Concentration of magnesium in the sample	52.8 micromole per kilogram						false		^[-+]?[0-9]*\.?[0-9]+ +\S.*$	string			MIXS:0000431			magnesium	
mean_frict_vel	SedimentInterface	mean friction velocity		measurement value	meter per second	1		Measurement of mean friction velocity	0.5 meter per second						false		^[-+]?[0-9]*\.?[0-9]+ +\S.*$	string			MIXS:0000498			mean friction velocity	
mean_peak_frict_vel	SedimentInterface	mean peak friction velocity		measurement value	meter per second	1		Measurement of mean peak friction velocity	1 meter per second						false		^[-+]?[0-9]*\.?[0-9]+ +\S.*$	string			MIXS:0000502			mean peak friction velocity	
