slot	class	aliases	annotations	aev	apu	ao	comments	description	examples	identifier	in_subset	maximum_value	minimum_value	mixin	multivalued	notes	pattern	range	recommended	required	slot_uri	string_serialization	structured_pattern	title	todos
description								a human-readable description of a thing							false			string			dcterms:description				
gold_path_field								This is a grouping for any of the gold path fields							false			string							
name								A human readable label for an entity							false			string							
	AirInterface							air dh_interface																Air	
air_PM_concen	AirInterface	air particulate matter concentration		particulate matter name;measurement value	micrograms per cubic meter	m		Concentration of substances that remain suspended in the air, and comprise mixtures of organic and inorganic substances (PM10 and PM2.5); can report multiple PM's by entering numeric values preceded by name of PM	PM2.5;10 microgram per cubic meter						false		^([^;\t\r\x0A]+;[-+]?[0-9]*\.?[0-9]+([eE][-+]?[0-9]+)? [^;\t\r\x0A]+\|)*([^;\t\r\x0A]+;[-+]?[0-9]*\.?[0-9]+([eE][-+]?[0-9]+)? [^;\t\r\x0A]+)$	string			MIXS:0000108	{text};{float} {unit}		air particulate matter concentration	
alt	AirInterface	altitude		measurement value				Altitude is a term used to identify heights of objects such as airplanes, space shuttles, rockets, atmospheric balloons and heights of places such as atmospheric layers and clouds. It is used to measure the height of an object which is above the earth's surface. In this context, the altitude measurement is the vertical distance between the earth's surface above sea level and the sampled position in the air	100 meter						false		^[-+]?[0-9]*\.?[0-9]+ +\S.*$	string	true		MIXS:0000094			altitude	
barometric_press	AirInterface	barometric pressure		measurement value	millibar	1		Force per unit area exerted against a surface by the weight of air above that surface	5 millibar						false		^[-+]?[0-9]*\.?[0-9]+ +\S.*$	string			MIXS:0000096			barometric pressure	
carb_dioxide	AirInterface	carbon dioxide		measurement value	micromole per liter, parts per million	1		Carbon dioxide (gas) amount or concentration at the time of sampling	410 parts per million						false		^[-+]?[0-9]*\.?[0-9]+ +\S.*$	string			MIXS:0000097			carbon dioxide	
carb_monoxide	AirInterface	carbon monoxide		measurement value	micromole per liter, parts per million	1		Carbon monoxide (gas) amount or concentration at the time of sampling	0.1 parts per million						false		^[-+]?[0-9]*\.?[0-9]+ +\S.*$	string			MIXS:0000098			carbon monoxide	
chem_administration	AirInterface	chemical administration		CHEBI;timestamp		m		List of chemical compounds administered to the host or site where sampling occurred, and when (e.g. Antibiotics, n fertilizer, air filter); can include multiple compounds. For chemical entities of biological interest ontology (chebi) (v 163), http://purl.bioontology.org/ontology/chebi	agar [CHEBI:2509];2018-05-11|agar [CHEBI:2509];2018-05-22|agar [CHEBI:2509];2018-05						false		^\S+.*\S+ \[[a-zA-Z]{2,}:\d+\];([\+-]?\d{4}(?!\d{2}\b))((-?)((0[1-9]|1[0-2])(\3([12]\d|0[1-9]|3[01]))?|W([0-4]\d|5[0-2])(-?[1-7])?|(00[1-9]|0[1-9]\d|[12]\d{2}|3([0-5]\d|6[1-6])))([T\s]((([01]\d|2[0-3])((:?)[0-5]\d)?|24\:?00)([\.,]\d+(?!:))?)?(\17[0-5]\d([\.,]\d+)?)?([zZ]|([\+-])([01]\d|2[0-3]):?([0-5]\d)?)?)?)?$	string	true		MIXS:0000751	{termLabel} {[termID]};{timestamp}		chemical administration	
collection_date	AirInterface	collection date		date and time				The date of sampling	2021-04-15|2021-04|2021						false	MIxS collection_date accepts (truncated) ISO8601. DH taking arb prec date only|Use modified term (amended definition)	^[12]\d{3}(?:(?:-(?:0[1-9]|1[0-2]))(?:-(?:0[1-9]|[12]\d|3[01]))?)?$	string		true	MIXS:0000011	{date, arbitrary precision}		collection date	
depth	AirInterface	depth		measurement value			All depths must be reported in meters. Provide the numerical portion only.	The vertical distance below local surface, e.g. for sediment or soil samples depth is measured from sediment or soil surface, respectively. Depth can be reported as an interval for subsurface samples.	0 - 0.1|1						false	Use modified term	^[-+]?[0-9]*\.?[0-9]+([eE][-+]?[0-9]+)?(\s*-\s*[-+]?[0-9]*\.?[0-9]+([eE][-+]?[0-9]+)?)?$	string		true	MIXS:0000018	{float}|{float}-{float}		depth, meters	
ecosystem	AirInterface						The abiotic factors play a profound role on the type and composition of organisms in a given environment. The GOLD Ecosystem at the top of the five-level classification system is aimed at capturing the broader environment from which an organism or environmental sample is collected. The three broad groups under Ecosystem are Environmental, Host-associated, and Engineered. They represent samples collected from a natural environment or from another organism or from engineered environments like bioreactors respectively.	An ecosystem is a combination of a physical environment (abiotic factors) and all the organisms (biotic factors) that interact with this environment. Ecosystem is in position 1/5 in a GOLD path.							false	range: string or EcosystemEnum? The enum could be dynamic or might be soil biased.		string	true						
ecosystem_category	AirInterface						The Environmental ecosystem (for example) is divided into Air, Aquatic and Terrestrial. Ecosystem categories for Host-associated samples can be individual hosts or phyla and for engineered samples it may be manipulated environments like bioreactors, solid waste etc.	Ecosystem categories represent divisions within the ecosystem based on specific characteristics of the environment from where an organism or sample is isolated. Ecosystem category is in position 2/5 in a GOLD path.							false	string or EcosystemCategoryEnum range?		string	true						
ecosystem_subtype	AirInterface						Ecosystem Type Marine (Environmental -> Aquatic -> Marine) is further divided (for example) into Intertidal zone, Coastal, Pelagic, Intertidal zone etc. in the Ecosystem subtype category.	Ecosystem subtypes represent further subdivision of Ecosystem types into more distinct subtypes. Ecosystem subtype is in position 4/5 in a GOLD path.							false	string or EcosystemSubtypeEnum range?		string	true						
ecosystem_type	AirInterface						The Aquatic ecosystem category (for example) may have ecosystem types like Marine or Thermal springs etc. Ecosystem category Air may have Indoor air or Outdoor air as different Ecosystem Types. In the case of Host-associated samples, ecosystem type can represent Respiratory system, Digestive system, Roots etc.	Ecosystem types represent things having common characteristics within the Ecosystem Category. These common characteristics based grouping is still broad but specific to the characteristics of a given environment. Ecosystem type is in position 3/5 in a GOLD path.							false	string or EcosystemTypeEnum range?		string	true						
elev	AirInterface						All elevations must be reported in meters. Provide the numerical portion only.	Elevation of the sampling site is its height above a fixed reference point, most commonly the mean sea level. Elevation is mainly used when referring to points on the earth's surface, while altitude is used for points above the surface, such as an aircraft in flight or a spacecraft in orbit.	225|0|1250						false			float		true	MIXS:0000093			elevation, meters	
env_broad_scale	AirInterface							In this field, report which major environmental system your sample or specimen came from. The systems identified should have a coarse spatial grain, to provide the general environmental context of where the sampling was done (e.g. were you in the desert or a rainforest?). We recommend using subclasses of ENVO's biome class: http://purl.obolibrary.org/obo/ENVO_00000428. Format (one term): termLabel [termID], Format (multiple terms): termLabel [termID]|termLabel [termID]|termLabel [termID]. Example: Annotating a water sample from the photic zone in middle of the Atlantic Ocean, consider: oceanic epipelagic zone biome [ENVO:01000033]. Example: Annotating a sample from the Amazon rainforest consider: tropical moist broadleaf forest biome [ENVO:01000228]. If needed, request new terms on the ENVO tracker, identified here: http://www.obofoundry.org/ontology/envo.html							false	"range changed to enumeration late in makefile, so this is modified (but ""sample ID"" anyway)"	^\S+.*\S+ \[[a-zA-Z]{2,}:\d+\]$	string		true	MIXS:0000012	{termLabel} {[termID]}		broad-scale environmental context	
env_local_scale	AirInterface							Report the entity or entities which are in the sample or specimen’s local vicinity and which you believe have significant causal influences on your sample or specimen. We recommend using EnvO terms which are of smaller spatial grain than your entry for env_broad_scale. Terms, such as anatomical sites, from other OBO Library ontologies which interoperate with EnvO (e.g. UBERON) are accepted in this field. EnvO documentation about how to use the field: https://github.com/EnvironmentOntology/envo/wiki/Using-ENVO-with-MIxS.	canopy [ENVO:00000047]|herb and fern layer [ENVO:01000337]|litter layer [ENVO:01000338]|understory [01000335]|shrub layer [ENVO:01000336]						false	"range changed to enumeration late in makefile, so this is modified (but ""sample ID"" anyway)"	^\S+.*\S+ \[[a-zA-Z]{2,}:\d+\]$	string		true	MIXS:0000013	{termLabel} {[termID]}		local environmental context	
env_medium	AirInterface							Report the environmental material(s) immediately surrounding the sample or specimen at the time of sampling. We recommend using subclasses of 'environmental material' (http://purl.obolibrary.org/obo/ENVO_00010483). EnvO documentation about how to use the field: https://github.com/EnvironmentOntology/envo/wiki/Using-ENVO-with-MIxS . Terms from other OBO ontologies are permissible as long as they reference mass/volume nouns (e.g. air, water, blood) and not discrete, countable entities (e.g. a tree, a leaf, a table top).	soil [ENVO:00001998]						false	"range changed to enumeration late in makefile, so this is modified (but ""sample ID"" anyway)"	^\S+.*\S+ \[[a-zA-Z]{2,}:\d+\]$	string		true	MIXS:0000014	{termLabel} {[termID]}		environmental medium	
env_package	AirInterface	environmental package						Select the MIxS enviromental package that best describes the environment from which your sample was collected.	soil		mixs extension				false			string		true				environmental package	
experimental_factor	AirInterface	experimental factor		text or EFO and/or OBI				Experimental factors are essentially the variable aspects of an experiment design which can be used to describe an experiment, or set of experiments, in an increasingly detailed manner. This field accepts ontology terms from Experimental Factor Ontology (EFO) and/or Ontology for Biomedical Investigations (OBI). For a browser of EFO (v 2.95) terms, please see http://purl.bioontology.org/ontology/EFO; for a browser of OBI (v 2018-02-12) terms please see http://purl.bioontology.org/ontology/OBI	time series design [EFO:EFO_0001779]						false			string			MIXS:0000008	{termLabel} {[termID]}|{text}		experimental factor	
geo_loc_name	AirInterface	geographic location (country and/or sea,region)		country or sea name (INSDC or GAZ): region(GAZ), specific location name				The geographical origin of the sample as defined by the country or sea name followed by specific region name.	USA: Maryland, Bethesda						false		^[^:, ][^:]*: [^:, ][^,]*, [^:, ].*$	string		true	MIXS:0000010	{text}: {text}, {text}		geographic location (country and/or sea,region)	
horizon_meth	AirInterface	soil horizon method		PMID,DOI or url		1		Reference or method used in determining the horizon							false			string			MIXS:0000321	{PMID}|{DOI}|{URL}		horizon method	
humidity	AirInterface	humidity		measurement value	gram per cubic meter	1		Amount of water vapour in the air, at the time of sampling	25 gram per cubic meter						false		^[-+]?[0-9]*\.?[0-9]+ +\S.*$	string			MIXS:0000100			humidity	
lat_lon	AirInterface							This is currently a required field but it's not clear if this should be required for human hosts							false	required where?|This is currently a required field but it's not clear if this should be required for human hosts	^[-+]?([1-8]?\d(\.\d+)?|90(\.0+)?)\s[-+]?(180(\.0+)?|((1[0-7]\d)|([1-9]?\d))(\.\d+)?)$	string		true	MIXS:0000009	{lat lon}		geographic location (latitude and longitude)	
methane	AirInterface	methane		measurement value	micromole per liter, parts per billion, parts per million	1		Methane (gas) amount or concentration at the time of sampling	1800 parts per billion						false		^[-+]?[0-9]*\.?[0-9]+ +\S.*$	string			MIXS:0000101			methane	
misc_param	AirInterface	miscellaneous parameter		parameter name;measurement value		m		Any other measurement performed or parameter collected, that is not listed here	Bicarbonate ion concentration;2075 micromole per kilogram						false		^([^;\t\r\x0A]+;[-+]?[0-9]*\.?[0-9]+([eE][-+]?[0-9]+)? [^;\t\r\x0A]+\|)*([^;\t\r\x0A]+;[-+]?[0-9]*\.?[0-9]+([eE][-+]?[0-9]+)? [^;\t\r\x0A]+)$	string			MIXS:0000752	{text};{float} {unit}		miscellaneous parameter	
organism_count	AirInterface	organism count		organism name;measurement value;enumeration	number of cells per cubic meter, number of cells per milliliter, number of cells per cubic centimeter	m		Total cell count of any organism (or group of organisms) per gram, volume or area of sample, should include name of organism followed by count. The method that was used for the enumeration (e.g. qPCR, atp, mpn, etc.) Should also be provided. (example: total prokaryotes; 3.5e7 cells per ml; qpcr)	total prokaryotes;3.5e7 cells per milliliter;qPCR						false		^([-+]?[0-9]*\.?[0-9]+ +\S.*\|)*([-+]?[0-9]*\.?[0-9]+ +\S.*)$	string			MIXS:0000103			organism count	
oxy_stat_samp	AirInterface							Oxygenation status of sample							false	this is now a hybrid of the oxy_stat_samp semantics and the rel_to_oxygen enumeration|this is now a hybrid of the oxy_stat_samp semantics and the rel_to_oxygen enumeration		rel_to_oxygen_enum			MIXS:0000753			oxygenation status of sample	
oxygen	AirInterface	oxygen		measurement value	milligram per liter, parts per million	1		Oxygen (gas) amount or concentration at the time of sampling	600 parts per million						false		^[-+]?[0-9]*\.?[0-9]+ +\S.*$	string			MIXS:0000104			oxygen	
perturbation	AirInterface	perturbation		perturbation type name;perturbation interval and duration		m		Type of perturbation, e.g. chemical administration, physical disturbance, etc., coupled with perturbation regimen including how many times the perturbation was repeated, how long each perturbation lasted, and the start and end time of the entire perturbation period; can include multiple perturbation types	antibiotic addition;R2/2018-05-11T14:30Z/2018-05-11T19:30Z/P1H30M						false			string			MIXS:0000754	{text};{Rn/start_time/end_time/duration}		perturbation	
pollutants	AirInterface	pollutants		pollutant name;measurement value	gram, mole per liter, milligram per liter, microgram per cubic meter	m		Pollutant types and, amount or concentrations measured at the time of sampling; can report multiple pollutants by entering numeric values preceded by name of pollutant	lead;0.15 microgram per cubic meter						false		^([^;\t\r\x0A]+;[-+]?[0-9]*\.?[0-9]+([eE][-+]?[0-9]+)? [^;\t\r\x0A]+\|)*([^;\t\r\x0A]+;[-+]?[0-9]*\.?[0-9]+([eE][-+]?[0-9]+)? [^;\t\r\x0A]+)$	string			MIXS:0000107	{text};{float} {unit}		pollutants	
rel_to_oxygen	AirInterface	relationship to oxygen		enumeration				Is this organism an aerobe, anaerobe? Please note that aerobic and anaerobic are valid descriptors for microbial environments	aerobe						false			rel_to_oxygen_enum			MIXS:0000015			relationship to oxygen	
salinity	AirInterface	salinity		measurement value	practical salinity unit, percentage	1		The total concentration of all dissolved salts in a liquid or solid sample. While salinity can be measured by a complete chemical analysis, this method is difficult and time consuming. More often, it is instead derived from the conductivity measurement. This is known as practical salinity. These derivations compare the specific conductance of the sample to a salinity standard such as seawater.	25 practical salinity unit						false		^[-+]?[0-9]*\.?[0-9]+ +\S.*$	string			MIXS:0000183			salinity	
samp_collec_device	AirInterface	sample collection device		device name			Report dimensions and details when applicable	The device used to collect an environmental sample. This field accepts terms listed under environmental sampling device (http://purl.obolibrary.org/obo/ENVO). This field also accepts terms listed under specimen collection device (http://purl.obolibrary.org/obo/GENEPIO_0002094).	swab, biopsy, niskin bottle, push core, drag swab [GENEPIO:0002713]						false			string	true		MIXS:0000002	{termLabel} {[termID]}|{text}		sample collection device	
samp_collec_method	AirInterface	sample collection method		PMID,DOI,url , or text			This can be a citation or description	The method employed for collecting the sample.	swabbing						false			string			MIXS:0001225	{PMID}|{DOI}|{URL}|{text}		sample collection method	
samp_mat_process	AirInterface	sample material processing		text				A brief description of any processing applied to the sample during or after retrieving the sample from environment, or a link to the relevant protocol(s) performed.	filtering of seawater|storing samples in ethanol						false			string			MIXS:0000016	{text}		sample material processing	
samp_size	AirInterface	amount or size of sample collected		measurement value	millliter, gram, milligram, liter		This refers to the TOTAL amount of sample collected from the experiment. NOT the amount sent to each institution or collected for a specific analysis.	The total amount or size (volume (ml), mass (g) or area (m2) ) of sample collected.	5 grams|10 mL						false		^[-+]?[0-9]*\.?[0-9]+([eE][-+]?[0-9]+)? \S+$	string			MIXS:0000001	{float} {unit}		amount or size of sample collected	
samp_store_dur	AirInterface	sample storage duration		duration		1		Duration for which the sample was stored	P1Y6M						false			string			MIXS:0000116	{duration}		sample storage duration	
samp_store_loc	AirInterface	sample storage location		location name		1		Location at which sample was stored, usually name of a specific freezer/room	Freezer no:5						false			string			MIXS:0000755	{text}		sample storage location	
samp_store_temp	AirInterface	sample storage temperature		measurement value	degree Celsius	1		Temperature at which the sample was stored (degrees are assumed)	-80 Celsius						false		^[-+]?[0-9]*\.?[0-9]+ +\S.*$	string		true	MIXS:0000110			sample storage temperature	
sample_link	AirInterface						This field allows multiple entries separated by ; (Examples: Soil collected from the field will link with the soil used in an incubation. The soil a plant was grown in links to the plant sample. An original culture sample was transferred to a new vial and generated a new sample)	A unique identifier to assign parent-child, subsample, or sibling samples. This is relevant when a sample or other material was used to generate the new sample.	IGSN:DSJ0284						false	"also tempted to include SampIdNewTermsMixin but if len(slot_usage.keys()) > 1 and ""placeholder"" in slot_usage.keys():AttributeError: 'list' object has no attribute 'keys'"	[^\:\n\r]+\:[^\:\n\r]+	string	true			{text}:{text}		sample linkage	
size_frac	AirInterface	size fraction selected		filter size value range				Filtering pore size used in sample preparation	0-0.22 micrometer						false			string			MIXS:0000017	{float}-{float} {unit}		size fraction selected	
solar_irradiance	AirInterface	solar irradiance		measurement value	kilowatts per square meter per day, ergs per square centimeter per second	1		The amount of solar energy that arrives at a specific area of a surface during a specific time interval	1.36 kilowatts per square meter per day						false		^[-+]?[0-9]*\.?[0-9]+ +\S.*$	string			MIXS:0000112			solar irradiance	
specific_ecosystem	AirInterface						Specific ecosystems help to define samples based on very specific characteristics of an environment under the five-level classification system.	Specific ecosystems represent specific features of the environment like aphotic zone in an ocean or gastric mucosa within a host digestive system. Specific ecosystem is in position 5/5 in a GOLD path.							false	string or SpecificEcosystemEnum range?		string	true						
temp	AirInterface	temperature		measurement value	degree Celsius			Temperature of the sample at the time of sampling.	25 degree Celsius						false		^[-+]?[0-9]*\.?[0-9]+ +\S.*$	string			MIXS:0000113			temperature	
ventilation_rate	AirInterface	ventilation rate		measurement value	cubic meter per minute, liters per second	1		Ventilation rate of the system in the sampled premises	750 cubic meter per minute						false		^[-+]?[0-9]*\.?[0-9]+ +\S.*$	string			MIXS:0000114			ventilation rate	
ventilation_type	AirInterface	ventilation type		ventilation type name		1		Ventilation system used in the sampled premises	Operable windows						false			string			MIXS:0000756	{text}		ventilation type	
volatile_org_comp	AirInterface	volatile organic compounds		volatile organic compound name;measurement value	microgram per cubic meter, parts per million, nanogram per liter	m		Concentration of carbon-based chemicals that easily evaporate at room temperature; can report multiple volatile organic compounds by entering numeric values preceded by name of compound	formaldehyde;500 nanogram per liter						false		^([^;\t\r\x0A]+;[-+]?[0-9]*\.?[0-9]+([eE][-+]?[0-9]+)? [^;\t\r\x0A]+\|)*([^;\t\r\x0A]+;[-+]?[0-9]*\.?[0-9]+([eE][-+]?[0-9]+)? [^;\t\r\x0A]+)$	string			MIXS:0000115	{text};{float} {unit}		volatile organic compounds	
wind_direction	AirInterface	wind direction		wind direction name		1		Wind direction is the direction from which a wind originates	Northwest						false			string			MIXS:0000757	{text}		wind direction	
wind_speed	AirInterface	wind speed		measurement value	meter per second, kilometer per hour	1		Speed of wind measured at the time of sampling	21 kilometer per hour						false		^[-+]?[0-9]*\.?[0-9]+ +\S.*$	string			MIXS:0000118			wind speed	
	BiofilmInterface							biofilm dh_interface																Biofilm	
alkalinity	BiofilmInterface	alkalinity		measurement value	milliequivalent per liter, milligram per liter	1		Alkalinity, the ability of a solution to neutralize acids to the equivalence point of carbonate or bicarbonate	50 milligram per liter						false		^[-+]?[0-9]*\.?[0-9]+ +\S.*$	string			MIXS:0000421			alkalinity	
alkyl_diethers	BiofilmInterface	alkyl diethers		measurement value	mole per liter	1		Concentration of alkyl diethers	0.005 mole per liter						false		^[-+]?[0-9]*\.?[0-9]+ +\S.*$	string			MIXS:0000490			alkyl diethers	
alt	BiofilmInterface	altitude		measurement value				Altitude is a term used to identify heights of objects such as airplanes, space shuttles, rockets, atmospheric balloons and heights of places such as atmospheric layers and clouds. It is used to measure the height of an object which is above the earth's surface. In this context, the altitude measurement is the vertical distance between the earth's surface above sea level and the sampled position in the air	100 meter						false		^[-+]?[0-9]*\.?[0-9]+ +\S.*$	string	true		MIXS:0000094			altitude	
aminopept_act	BiofilmInterface	aminopeptidase activity		measurement value	mole per liter per hour	1		Measurement of aminopeptidase activity	0.269 mole per liter per hour						false		^[-+]?[0-9]*\.?[0-9]+ +\S.*$	string			MIXS:0000172			aminopeptidase activity	
ammonium	BiofilmInterface	ammonium		measurement value	micromole per liter, milligram per liter, parts per million	1		Concentration of ammonium in the sample	1.5 milligram per liter						false		^[-+]?[0-9]*\.?[0-9]+ +\S.*$	string			MIXS:0000427			ammonium	
bacteria_carb_prod	BiofilmInterface	bacterial carbon production		measurement value	nanogram per hour	1		Measurement of bacterial carbon production	2.53 microgram per liter per hour						false		^[-+]?[0-9]*\.?[0-9]+ +\S.*$	string			MIXS:0000173			bacterial carbon production	
biomass	BiofilmInterface	biomass		biomass type;measurement value	ton, kilogram, gram	m		Amount of biomass; should include the name for the part of biomass measured, e.g. Microbial, total. Can include multiple measurements	total;20 gram						false		^([^;\t\r\x0A]+;[-+]?[0-9]*\.?[0-9]+([eE][-+]?[0-9]+)? [^;\t\r\x0A]+\|)*([^;\t\r\x0A]+;[-+]?[0-9]*\.?[0-9]+([eE][-+]?[0-9]+)? [^;\t\r\x0A]+)$	string			MIXS:0000174	{text};{float} {unit}		biomass	
bishomohopanol	BiofilmInterface	bishomohopanol		measurement value	microgram per liter, microgram per gram	1		Concentration of bishomohopanol	14 microgram per liter						false		^[-+]?[0-9]*\.?[0-9]+ +\S.*$	string			MIXS:0000175			bishomohopanol	
bromide	BiofilmInterface	bromide		measurement value	parts per million	1		Concentration of bromide	0.05 parts per million						false		^[-+]?[0-9]*\.?[0-9]+ +\S.*$	string			MIXS:0000176			bromide	
calcium	BiofilmInterface	calcium		measurement value	milligram per liter, micromole per liter, parts per million	1		Concentration of calcium in the sample	0.2 micromole per liter						false		^[-+]?[0-9]*\.?[0-9]+ +\S.*$	string			MIXS:0000432			calcium	
carb_nitro_ratio	BiofilmInterface	carbon/nitrogen ratio		measurement value		1		Ratio of amount or concentrations of carbon to nitrogen	0.417361111						false		^[-+]?[0-9]*\.?[0-9]+ +\S.*$	float			MIXS:0000310			carbon/nitrogen ratio	
