slot	class	aliases	annotations	aev	apu	ao	comments	description	examples	identifier	in_subset	maximum_value	minimum_value	mixin	multivalued	notes	pattern	range	recommended	required	slot_uri	string_serialization	structured_pattern	title	todos
diss_oxygen_fluid	HcrFluidsSwabsInterface	dissolved oxygen in fluids		measurement value	micromole per kilogram, milligram per liter	1		Concentration of dissolved oxygen in the oil field produced fluids as it contributes to oxgen-corrosion and microbial activity (e.g. Mic).							false		^[-+]?[0-9]*\.?[0-9]+ +\S.*$	string			MIXS:0000438			dissolved oxygen in fluids	
ecosystem	HcrFluidsSwabsInterface						The abiotic factors play a profound role on the type and composition of organisms in a given environment. The GOLD Ecosystem at the top of the five-level classification system is aimed at capturing the broader environment from which an organism or environmental sample is collected. The three broad groups under Ecosystem are Environmental, Host-associated, and Engineered. They represent samples collected from a natural environment or from another organism or from engineered environments like bioreactors respectively.	An ecosystem is a combination of a physical environment (abiotic factors) and all the organisms (biotic factors) that interact with this environment. Ecosystem is in position 1/5 in a GOLD path.							false	range: string or EcosystemEnum? The enum could be dynamic or might be soil biased.		string	true						
ecosystem_category	HcrFluidsSwabsInterface						The Environmental ecosystem (for example) is divided into Air, Aquatic and Terrestrial. Ecosystem categories for Host-associated samples can be individual hosts or phyla and for engineered samples it may be manipulated environments like bioreactors, solid waste etc.	Ecosystem categories represent divisions within the ecosystem based on specific characteristics of the environment from where an organism or sample is isolated. Ecosystem category is in position 2/5 in a GOLD path.							false	string or EcosystemCategoryEnum range?		string	true						
ecosystem_subtype	HcrFluidsSwabsInterface						Ecosystem Type Marine (Environmental -> Aquatic -> Marine) is further divided (for example) into Intertidal zone, Coastal, Pelagic, Intertidal zone etc. in the Ecosystem subtype category.	Ecosystem subtypes represent further subdivision of Ecosystem types into more distinct subtypes. Ecosystem subtype is in position 4/5 in a GOLD path.							false	string or EcosystemSubtypeEnum range?		string	true						
ecosystem_type	HcrFluidsSwabsInterface						The Aquatic ecosystem category (for example) may have ecosystem types like Marine or Thermal springs etc. Ecosystem category Air may have Indoor air or Outdoor air as different Ecosystem Types. In the case of Host-associated samples, ecosystem type can represent Respiratory system, Digestive system, Roots etc.	Ecosystem types represent things having common characteristics within the Ecosystem Category. These common characteristics based grouping is still broad but specific to the characteristics of a given environment. Ecosystem type is in position 3/5 in a GOLD path.							false	string or EcosystemTypeEnum range?		string	true						
elev	HcrFluidsSwabsInterface						All elevations must be reported in meters. Provide the numerical portion only.	Elevation of the sampling site is its height above a fixed reference point, most commonly the mean sea level. Elevation is mainly used when referring to points on the earth's surface, while altitude is used for points above the surface, such as an aircraft in flight or a spacecraft in orbit.	225|0|1250						false			float		true	MIXS:0000093			elevation, meters	
env_broad_scale	HcrFluidsSwabsInterface							In this field, report which major environmental system your sample or specimen came from. The systems identified should have a coarse spatial grain, to provide the general environmental context of where the sampling was done (e.g. were you in the desert or a rainforest?). We recommend using subclasses of ENVO's biome class: http://purl.obolibrary.org/obo/ENVO_00000428. Format (one term): termLabel [termID], Format (multiple terms): termLabel [termID]|termLabel [termID]|termLabel [termID]. Example: Annotating a water sample from the photic zone in middle of the Atlantic Ocean, consider: oceanic epipelagic zone biome [ENVO:01000033]. Example: Annotating a sample from the Amazon rainforest consider: tropical moist broadleaf forest biome [ENVO:01000228]. If needed, request new terms on the ENVO tracker, identified here: http://www.obofoundry.org/ontology/envo.html							false	"range changed to enumeration late in makefile, so this is modified (but ""sample ID"" anyway)"	^\S+.*\S+ \[[a-zA-Z]{2,}:\d+\]$	string		true	MIXS:0000012	{termLabel} {[termID]}		broad-scale environmental context	
env_local_scale	HcrFluidsSwabsInterface							Report the entity or entities which are in the sample or specimen’s local vicinity and which you believe have significant causal influences on your sample or specimen. We recommend using EnvO terms which are of smaller spatial grain than your entry for env_broad_scale. Terms, such as anatomical sites, from other OBO Library ontologies which interoperate with EnvO (e.g. UBERON) are accepted in this field. EnvO documentation about how to use the field: https://github.com/EnvironmentOntology/envo/wiki/Using-ENVO-with-MIxS.	canopy [ENVO:00000047]|herb and fern layer [ENVO:01000337]|litter layer [ENVO:01000338]|understory [01000335]|shrub layer [ENVO:01000336]						false	"range changed to enumeration late in makefile, so this is modified (but ""sample ID"" anyway)"	^\S+.*\S+ \[[a-zA-Z]{2,}:\d+\]$	string		true	MIXS:0000013	{termLabel} {[termID]}		local environmental context	
env_medium	HcrFluidsSwabsInterface							Report the environmental material(s) immediately surrounding the sample or specimen at the time of sampling. We recommend using subclasses of 'environmental material' (http://purl.obolibrary.org/obo/ENVO_00010483). EnvO documentation about how to use the field: https://github.com/EnvironmentOntology/envo/wiki/Using-ENVO-with-MIxS . Terms from other OBO ontologies are permissible as long as they reference mass/volume nouns (e.g. air, water, blood) and not discrete, countable entities (e.g. a tree, a leaf, a table top).	soil [ENVO:00001998]						false	"range changed to enumeration late in makefile, so this is modified (but ""sample ID"" anyway)"	^\S+.*\S+ \[[a-zA-Z]{2,}:\d+\]$	string		true	MIXS:0000014	{termLabel} {[termID]}		environmental medium	
env_package	HcrFluidsSwabsInterface	environmental package						Select the MIxS enviromental package that best describes the environment from which your sample was collected.	soil		mixs extension				false			string		true				environmental package	
ethylbenzene	HcrFluidsSwabsInterface	ethylbenzene		measurement value	milligram per liter, parts per million	1		Concentration of ethylbenzene in the sample							false		^[-+]?[0-9]*\.?[0-9]+ +\S.*$	string			MIXS:0000155			ethylbenzene	
experimental_factor	HcrFluidsSwabsInterface	experimental factor		text or EFO and/or OBI				Experimental factors are essentially the variable aspects of an experiment design which can be used to describe an experiment, or set of experiments, in an increasingly detailed manner. This field accepts ontology terms from Experimental Factor Ontology (EFO) and/or Ontology for Biomedical Investigations (OBI). For a browser of EFO (v 2.95) terms, please see http://purl.bioontology.org/ontology/EFO; for a browser of OBI (v 2018-02-12) terms please see http://purl.bioontology.org/ontology/OBI	time series design [EFO:EFO_0001779]						false			string			MIXS:0000008	{termLabel} {[termID]}|{text}		experimental factor	
field	HcrFluidsSwabsInterface	field name		name		1		Name of the hydrocarbon field (e.g. Albacora)							false			string			MIXS:0000291	{text}		field name	
geo_loc_name	HcrFluidsSwabsInterface	geographic location (country and/or sea,region)		country or sea name (INSDC or GAZ): region(GAZ), specific location name				The geographical origin of the sample as defined by the country or sea name followed by specific region name.	USA: Maryland, Bethesda						false		^[^:, ][^:]*: [^:, ][^,]*, [^:, ].*$	string		true	MIXS:0000010	{text}: {text}, {text}		geographic location (country and/or sea,region)	
hc_produced	HcrFluidsSwabsInterface	hydrocarbon type produced		enumeration		1		"Main hydrocarbon type produced from resource (i.e. Oil, gas, condensate, etc). If ""other"" is specified, please propose entry in ""additional info"" field"	Gas						false			hc_produced_enum			MIXS:0000989			hydrocarbon type produced	
hcr	HcrFluidsSwabsInterface	hydrocarbon resource type		enumeration		1		"Main Hydrocarbon Resource type. The term ""Hydrocarbon Resource"" HCR defined as a natural environmental feature containing large amounts of hydrocarbons at high concentrations potentially suitable for commercial exploitation. This term should not be confused with the Hydrocarbon Occurrence term which also includes hydrocarbon-rich environments with currently limited commercial interest such as seeps, outcrops, gas hydrates etc. If ""other"" is specified, please propose entry in ""additional info"" field"	Oil Sand						false			hcr_enum			MIXS:0000988			hydrocarbon resource type	
hcr_fw_salinity	HcrFluidsSwabsInterface	formation water salinity		measurement value	milligram per liter	1		Original formation water salinity (prior to secondary recovery e.g. Waterflooding) expressed as TDS							false		^[-+]?[0-9]*\.?[0-9]+ +\S.*$	string			MIXS:0000406			formation water salinity	
hcr_geol_age	HcrFluidsSwabsInterface	hydrocarbon resource geological age		enumeration		1		"Geological age of hydrocarbon resource (Additional info: https://en.wikipedia.org/wiki/Period_(geology)). If ""other"" is specified, please propose entry in ""additional info"" field"	Silurian						false			hcr_geol_age_enum			MIXS:0000993			hydrocarbon resource geological age	
hcr_pressure	HcrFluidsSwabsInterface	hydrocarbon resource original pressure		measurement value range	atmosphere, kilopascal	1		Original pressure of the hydrocarbon resource							false			string			MIXS:0000395	{float} - {float} {unit}		hydrocarbon resource original pressure	
hcr_temp	HcrFluidsSwabsInterface	hydrocarbon resource original temperature		measurement value range	degree Celsius	1		Original temperature of the hydrocarbon resource	150-295 degree Celsius						false			string			MIXS:0000393	{float} - {float} {unit}		hydrocarbon resource original temperature	
horizon_meth	HcrFluidsSwabsInterface	soil horizon method		PMID,DOI or url		1		Reference or method used in determining the horizon							false			string			MIXS:0000321	{PMID}|{DOI}|{URL}		horizon method	
iw_bt_date_well	HcrFluidsSwabsInterface	injection water breakthrough date of specific well		timestamp		1		Injection water breakthrough date per well following a secondary and/or tertiary recovery	2018-05-11						false			string			MIXS:0001010			injection water breakthrough date of specific well	
iwf	HcrFluidsSwabsInterface	injection water fraction		measurement value	percent	1		Proportion of the produced fluids derived from injected water at the time of sampling. (e.g. 87%)							false		^[-+]?[0-9]*\.?[0-9]+ +\S.*$	string			MIXS:0000455			injection water fraction	
lat_lon	HcrFluidsSwabsInterface							This is currently a required field but it's not clear if this should be required for human hosts							false	required where?|This is currently a required field but it's not clear if this should be required for human hosts	^[-+]?([1-8]?\d(\.\d+)?|90(\.0+)?)\s[-+]?(180(\.0+)?|((1[0-7]\d)|([1-9]?\d))(\.\d+)?)$	string		true	MIXS:0000009	{lat lon}		geographic location (latitude and longitude)	
lithology	HcrFluidsSwabsInterface	lithology		enumeration		1		"Hydrocarbon resource main lithology (Additional information: http://petrowiki.org/Lithology_and_rock_type_determination). If ""other"" is specified, please propose entry in ""additional info"" field"	Volcanic						false			lithology_enum			MIXS:0000990			lithology	
magnesium	HcrFluidsSwabsInterface	magnesium		measurement value	mole per liter, milligram per liter, parts per million, micromole per kilogram	1		Concentration of magnesium in the sample	52.8 micromole per kilogram						false		^[-+]?[0-9]*\.?[0-9]+ +\S.*$	string			MIXS:0000431			magnesium	
misc_param	HcrFluidsSwabsInterface	miscellaneous parameter		parameter name;measurement value		m		Any other measurement performed or parameter collected, that is not listed here	Bicarbonate ion concentration;2075 micromole per kilogram						false		^([^;\t\r\x0A]+;[-+]?[0-9]*\.?[0-9]+([eE][-+]?[0-9]+)? [^;\t\r\x0A]+\|)*([^;\t\r\x0A]+;[-+]?[0-9]*\.?[0-9]+([eE][-+]?[0-9]+)? [^;\t\r\x0A]+)$	string			MIXS:0000752	{text};{float} {unit}		miscellaneous parameter	
nitrate	HcrFluidsSwabsInterface	nitrate		measurement value	micromole per liter, milligram per liter, parts per million	1		Concentration of nitrate in the sample	65 micromole per liter						false		^[-+]?[0-9]*\.?[0-9]+ +\S.*$	string			MIXS:0000425			nitrate	
nitrite	HcrFluidsSwabsInterface	nitrite		measurement value	micromole per liter, milligram per liter, parts per million	1		Concentration of nitrite in the sample	0.5 micromole per liter						false		^[-+]?[0-9]*\.?[0-9]+ +\S.*$	string			MIXS:0000426			nitrite	
org_count_qpcr_info	HcrFluidsSwabsInterface	organism count qPCR information		gene name;FWD:forward primer sequence;REV:reverse primer sequence;initial denaturation:degrees_minutes;denaturation:degrees_minutes;annealing:degrees_minutes;elongation:degrees_minutes;final elongation:degrees_minutes; total cycles	number of cells per gram (or ml or cm^2)	1		If qpcr was used for the cell count, the target gene name, the primer sequence and the cycling conditions should also be provided. (Example: 16S rrna; FWD:ACGTAGCTATGACGT REV:GTGCTAGTCGAGTAC; initial denaturation:90C_5min; denaturation:90C_2min; annealing:52C_30 sec; elongation:72C_30 sec; 90 C for 1 min; final elongation:72C_5min; 30 cycles)							false			string			MIXS:0000099	{text};FWD:{dna};REV:{dna};initial denaturation:degrees_minutes;denaturation:degrees_minutes;annealing:degrees_minutes;elongation:degrees_minutes;final elongation:degrees_minutes; total cycles		organism count qPCR information	
organism_count	HcrFluidsSwabsInterface	organism count		organism name;measurement value;enumeration	number of cells per cubic meter, number of cells per milliliter, number of cells per cubic centimeter	m		Total cell count of any organism (or group of organisms) per gram, volume or area of sample, should include name of organism followed by count. The method that was used for the enumeration (e.g. qPCR, atp, mpn, etc.) Should also be provided. (example: total prokaryotes; 3.5e7 cells per ml; qpcr)	total prokaryotes;3.5e7 cells per milliliter;qPCR						false		^([-+]?[0-9]*\.?[0-9]+ +\S.*\|)*([-+]?[0-9]*\.?[0-9]+ +\S.*)$	string			MIXS:0000103			organism count	
oxy_stat_samp	HcrFluidsSwabsInterface							Oxygenation status of sample							false	this is now a hybrid of the oxy_stat_samp semantics and the rel_to_oxygen enumeration|this is now a hybrid of the oxy_stat_samp semantics and the rel_to_oxygen enumeration		rel_to_oxygen_enum			MIXS:0000753			oxygenation status of sample	
ph	HcrFluidsSwabsInterface	pH		measurement value		1		pH measurement of the sample, or liquid portion of sample, or aqueous phase of the fluid	7.2			14	0		false	Use modified term		float	true		MIXS:0001001	{float}		pH	
ph_meth	HcrFluidsSwabsInterface						This can include a link to the instrument used or a citation for the method.	Reference or method used in determining ph	https://www.southernlabware.com/pc9500-benchtop-ph-conductivity-meter-kit-ph-accuracy-2000mv-ph-range-2-000-to-20-000.html?gclid=Cj0KCQiAwJWdBhCYARIsAJc4idCO5vtvbVMf545fcvdROFqa6zjzNSoywNx6K4k9Coo9cCc2pybtvGsaAiR0EALw_wcB|https://doi.org/10.2136/sssabookser5.3.c16						false			string			MIXS:0001106	{PMID}|{DOI}|{URL}		pH method	
potassium	HcrFluidsSwabsInterface	potassium		measurement value	milligram per liter, parts per million	1		Concentration of potassium in the sample	463 milligram per liter						false		^[-+]?[0-9]*\.?[0-9]+ +\S.*$	string			MIXS:0000430			potassium	
pour_point	HcrFluidsSwabsInterface	pour point		measurement value	degree Celsius	1		Temperature at which a liquid becomes semi solid and loses its flow characteristics. In crude oil a high¬†pour point¬†is generally associated with a high paraffin content, typically found in crude deriving from a larger proportion of plant material. (soure: https://en.wikipedia.org/wiki/pour_point)							false		^[-+]?[0-9]*\.?[0-9]+ +\S.*$	string			MIXS:0000127			pour point	
pressure	HcrFluidsSwabsInterface	pressure		measurement value	atmosphere	1		Pressure to which the sample is subject to, in atmospheres	50 atmosphere						false		^[-+]?[0-9]*\.?[0-9]+ +\S.*$	string			MIXS:0000412			pressure	
prod_rate	HcrFluidsSwabsInterface	production rate		measurement value	cubic meter per day	1		Oil and/or gas production rates per well (e.g. 524 m3 / day)							false		^[-+]?[0-9]*\.?[0-9]+ +\S.*$	string			MIXS:0000452			production rate	
prod_start_date	HcrFluidsSwabsInterface	production start date		timestamp		1		Date of field's first production	2018-05-11						false			string			MIXS:0001008			production start date	
rel_to_oxygen	HcrFluidsSwabsInterface	relationship to oxygen		enumeration				Is this organism an aerobe, anaerobe? Please note that aerobic and anaerobic are valid descriptors for microbial environments	aerobe						false			rel_to_oxygen_enum			MIXS:0000015			relationship to oxygen	
reservoir	HcrFluidsSwabsInterface	reservoir name		name		1		Name of the reservoir (e.g. Carapebus)							false			string			MIXS:0000303	{text}		reservoir name	
resins_pc	HcrFluidsSwabsInterface	resins wt%		name;measurement value	percent	1		Saturate, Aromatic, Resin and Asphaltene¬†(SARA) is an analysis method that divides¬†crude oil¬†components according to their polarizability and polarity. There are three main methods to obtain SARA results. The most popular one is known as the Iatroscan TLC-FID and is referred to as IP-143 (source: https://en.wikipedia.org/wiki/Saturate,_aromatic,_resin_and_asphaltene)							false		^[^;\t\r\x0A\|]+;[-+]?[0-9]*\.?[0-9]+([eE][-+]?[0-9]+)? [^;\t\r\x0A\|]+$	string			MIXS:0000134	{text};{float} {unit}		resins wt%	
salinity	HcrFluidsSwabsInterface	salinity		measurement value	practical salinity unit, percentage	1		The total concentration of all dissolved salts in a liquid or solid sample. While salinity can be measured by a complete chemical analysis, this method is difficult and time consuming. More often, it is instead derived from the conductivity measurement. This is known as practical salinity. These derivations compare the specific conductance of the sample to a salinity standard such as seawater.	25 practical salinity unit						false		^[-+]?[0-9]*\.?[0-9]+ +\S.*$	string			MIXS:0000183			salinity	
samp_collec_device	HcrFluidsSwabsInterface	sample collection device		device name			Report dimensions and details when applicable	The device used to collect an environmental sample. This field accepts terms listed under environmental sampling device (http://purl.obolibrary.org/obo/ENVO). This field also accepts terms listed under specimen collection device (http://purl.obolibrary.org/obo/GENEPIO_0002094).	swab, biopsy, niskin bottle, push core, drag swab [GENEPIO:0002713]						false			string	true		MIXS:0000002	{termLabel} {[termID]}|{text}		sample collection device	
samp_collec_method	HcrFluidsSwabsInterface	sample collection method		PMID,DOI,url , or text			This can be a citation or description	The method employed for collecting the sample.	swabbing						false			string			MIXS:0001225	{PMID}|{DOI}|{URL}|{text}		sample collection method	
samp_collect_point	HcrFluidsSwabsInterface	sample collection point		enumeration		1		"Sampling point on the asset were sample was collected (e.g. Wellhead, storage tank, separator, etc). If ""other"" is specified, please propose entry in ""additional info"" field"	well						false			samp_collect_point_enum			MIXS:0001015			sample collection point	
samp_loc_corr_rate	HcrFluidsSwabsInterface	corrosion rate at sample location		measurement value range	millimeter per year	1		Metal corrosion rate is the speed of metal deterioration due to environmental conditions. As environmental conditions change corrosion rates change accordingly. Therefore, long term corrosion rates are generally more informative than short term rates and for that reason they are preferred during reporting. In the case of suspected MIC, corrosion rate measurements at the time of sampling might provide insights into the involvement of certain microbial community members in MIC as well as potential microbial interplays							false			string			MIXS:0000136	{float} - {float} {unit}		corrosion rate at sample location	
samp_mat_process	HcrFluidsSwabsInterface	sample material processing		text				A brief description of any processing applied to the sample during or after retrieving the sample from environment, or a link to the relevant protocol(s) performed.	filtering of seawater|storing samples in ethanol						false			string			MIXS:0000016	{text}		sample material processing	
samp_preserv	HcrFluidsSwabsInterface	preservative added to sample		name;measurement value	milliliter	1		Preservative added to the sample (e.g. Rnalater, alcohol, formaldehyde, etc.). Where appropriate include volume added (e.g. Rnalater; 2 ml)							false		^[^;\t\r\x0A\|]+;[-+]?[0-9]*\.?[0-9]+([eE][-+]?[0-9]+)? [^;\t\r\x0A\|]+$	string			MIXS:0000463	{text};{float} {unit}		preservative added to sample	
samp_size	HcrFluidsSwabsInterface	amount or size of sample collected		measurement value	millliter, gram, milligram, liter		This refers to the TOTAL amount of sample collected from the experiment. NOT the amount sent to each institution or collected for a specific analysis.	The total amount or size (volume (ml), mass (g) or area (m2) ) of sample collected.	5 grams|10 mL						false		^[-+]?[0-9]*\.?[0-9]+([eE][-+]?[0-9]+)? \S+$	string			MIXS:0000001	{float} {unit}		amount or size of sample collected	
samp_store_dur	HcrFluidsSwabsInterface	sample storage duration		duration		1		Duration for which the sample was stored	P1Y6M						false			string			MIXS:0000116	{duration}		sample storage duration	
samp_store_loc	HcrFluidsSwabsInterface	sample storage location		location name		1		Location at which sample was stored, usually name of a specific freezer/room	Freezer no:5						false			string			MIXS:0000755	{text}		sample storage location	
samp_store_temp	HcrFluidsSwabsInterface	sample storage temperature		measurement value	degree Celsius	1		Temperature at which the sample was stored (degrees are assumed)	-80 Celsius						false		^[-+]?[0-9]*\.?[0-9]+ +\S.*$	string		true	MIXS:0000110			sample storage temperature	
samp_subtype	HcrFluidsSwabsInterface	sample subtype		enumeration		1		"Name of sample sub-type. For example if ""sample type"" is ""Produced Water"" then subtype could be ""Oil Phase"" or ""Water Phase"". If ""other"" is specified, please propose entry in ""additional info"" field"	biofilm						false			samp_subtype_enum			MIXS:0000999			sample subtype	
samp_transport_cond	HcrFluidsSwabsInterface	sample transport conditions		measurement value;measurement value	days;degree Celsius	1		Sample transport duration (in days or hrs) and temperature the sample was exposed to (e.g. 5.5 days; 20 ¬∞C)	5 days;-20 degree Celsius						false			string			MIXS:0000410	{float} {unit};{float} {unit}		sample transport conditions	
samp_type	HcrFluidsSwabsInterface	sample type		GENEPIO:0001246		1		The type of material from which the sample was obtained. For the Hydrocarbon package, samples include types like core, rock trimmings, drill cuttings, piping section, coupon, pigging debris, solid deposit, produced fluid, produced water, injected water, swabs, etc. For the Food Package, samples are usually categorized as food, body products or tissues, or environmental material. This field accepts terms listed under environmental specimen (http://purl.obolibrary.org/obo/GENEPIO_0001246).	built environment sample [GENEPIO:0001248]						false		^\S+.*\S+ \[[a-zA-Z]{2,}:\d+\]$	string			MIXS:0000998	{termLabel} {[termID]}		sample type	
samp_well_name	HcrFluidsSwabsInterface	sample well name		name		1		Name of the well (e.g. BXA1123) where sample was taken							false			string			MIXS:0000296	{text}		sample well name	
sample_link	HcrFluidsSwabsInterface						This field allows multiple entries separated by ; (Examples: Soil collected from the field will link with the soil used in an incubation. The soil a plant was grown in links to the plant sample. An original culture sample was transferred to a new vial and generated a new sample)	A unique identifier to assign parent-child, subsample, or sibling samples. This is relevant when a sample or other material was used to generate the new sample.	IGSN:DSJ0284						false	"also tempted to include SampIdNewTermsMixin but if len(slot_usage.keys()) > 1 and ""placeholder"" in slot_usage.keys():AttributeError: 'list' object has no attribute 'keys'"	[^\:\n\r]+\:[^\:\n\r]+	string	true			{text}:{text}		sample linkage	
saturates_pc	HcrFluidsSwabsInterface	saturates wt%		name;measurement value	percent	1		Saturate, Aromatic, Resin and Asphaltene¬†(SARA) is an analysis method that divides¬†crude oil¬†components according to their polarizability and polarity. There are three main methods to obtain SARA results. The most popular one is known as the Iatroscan TLC-FID and is referred to as IP-143 (source: https://en.wikipedia.org/wiki/Saturate,_aromatic,_resin_and_asphaltene)							false		^[^;\t\r\x0A\|]+;[-+]?[0-9]*\.?[0-9]+([eE][-+]?[0-9]+)? [^;\t\r\x0A\|]+$	string			MIXS:0000131	{text};{float} {unit}		saturates wt%	
