slot	class	aliases	annotations	aev	apu	ao	comments	description	examples	identifier	in_subset	maximum_value	minimum_value	mixin	multivalued	notes	pattern	range	recommended	required	slot_uri	string_serialization	structured_pattern	title	todos
> slot	class	aliases	ignore	annotations	annotations	annotations	comments	description	examples	identifier	in_subset	maximum_value	minimum_value	mixin	multivalued	notes	pattern	range	recommended	required	slot_uri	string_serialization	structured_pattern	title	todos
>		"internal_separator: ""|"""		inner_key: expected_value	inner_key: preferred_unit	inner_key: occurrence	"internal_separator: ""|"""		"internal_separator: ""|"""		"internal_separator: ""|"""					"internal_separator: ""|"""									"internal_separator: ""|"""
air_data								aggregation slot relating air data collections to a SampleData container							true			AirInterface							
biofilm_data								aggregation slot relating biofilm data collections to a SampleData container							true			BiofilmInterface							
built_env_data								aggregation slot relating built_env data collections to a SampleData container							true			BuiltEnvInterface							
emsl_data								aggregation slot relating emsl data collections to a SampleData container							true			EmslInterface							
hcr_cores_data								aggregation slot relating hcr_cores data collections to a SampleData container							true			HcrCoresInterface							
hcr_fluids_swabs_data								aggregation slot relating hcr_fluids_swabs data collections to a SampleData container							true			HcrFluidsSwabsInterface							
host_associated_data								aggregation slot relating host_associated data collections to a SampleData container							true			HostAssociatedInterface							
jgi_mg_data								aggregation slot relating jgi_mg data collections to a SampleData container							true			JgiMgInterface							
jgi_mt_data								aggregation slot relating jgi_mt data collections to a SampleData container							true			JgiMtInterface							
misc_envs_data								aggregation slot relating misc_envs data collections to a SampleData container							true			MiscEnvsInterface							
plant_associated_data								aggregation slot relating plant_associated data collections to a SampleData container							true			PlantAssociatedInterface							
sediment_data								aggregation slot relating sediment data collections to a SampleData container							true			SedimentInterface							
soil_data								aggregation slot relating soil data collections to a SampleData container							true			SoilInterface							
wastewater_sludge_data								aggregation slot relating wastewater_sludge data collections to a SampleData container							true			WastewaterSludgeInterface							
water_data								aggregation slot relating water data collections to a SampleData container							true			WaterInterface							
dh_section								dh_section grouping slot																	
emsl_section								placeholder																EMSL	
jgi_metagenomics_section								placeholder																JGI-Metagenomics	
jgi_metatranscriptomics_section								placeholder																JGI-Metatranscriptomics	
mixs_core_section								placeholder																MIxS Core	
mixs_inspired_section								placeholder																MIxS Inspired	
mixs_investigation_section								placeholder																	
mixs_modified_section								placeholder																MIxS (modified)	
mixs_nassf_section								placeholder																	
mixs_section								placeholder																MIxS	
sample_id_section								placeholder																Sample ID	
abs_air_humidity		absolute air humidity		measurement value	gram per gram, kilogram per kilogram, kilogram, pound	1		Actual mass of water vapor - mh20 - present in the air water vapor mixture	9 gram per gram						false			string			MIXS:0000122			absolute air humidity	
add_recov_method		secondary and tertiary recovery methods and start date		enumeration;timestamp		1		"Additional (i.e. Secondary, tertiary, etc.) recovery methods deployed for increase of hydrocarbon recovery from resource and start date for each one of them. If ""other"" is specified, please propose entry in ""additional info"" field"	Polymer Addition;2018-06-21T14:30Z						false			string			MIXS:0001009			secondary and tertiary recovery methods and start date	
additional_info		additional info		text		1		Information that doesn't fit anywhere else. Can also be used to propose new entries for fields with controlled vocabulary							false			string			MIXS:0000300	{text}		additional info	
address		address		value		1		The street name and building number where the sampling occurred.							false			string			MIXS:0000218	{integer}{text}		address	
adj_room		adjacent rooms		room name;room number		1		List of rooms (room number, room name) immediately adjacent to the sampling room							false			string			MIXS:0000219	{text};{integer}		adjacent rooms	
aero_struc		aerospace structure		enumeration		1		Aerospace structures typically consist of thin plates with stiffeners for the external surfaces, bulkheads and frames to support the shape and fasteners such as welds, rivets, screws and bolts to hold the components together	plane						false			string			MIXS:0000773	[plane|glider]		aerospace structure	
agrochem_addition		history/agrochemical additions		agrochemical name;agrochemical amount;timestamp	gram, mole per liter, milligram per liter	m		Addition of fertilizers, pesticides, etc. - amount and time of applications	roundup;5 milligram per liter;2018-06-21						false			string			MIXS:0000639	{text};{float} {unit};{timestamp}		history/agrochemical additions	
air_PM_concen		air particulate matter concentration		particulate matter name;measurement value	micrograms per cubic meter	m		Concentration of substances that remain suspended in the air, and comprise mixtures of organic and inorganic substances (PM10 and PM2.5); can report multiple PM's by entering numeric values preceded by name of PM	PM2.5;10 microgram per cubic meter						false			string			MIXS:0000108	{text};{float} {unit}		air particulate matter concentration	
air_temp		air temperature		measurement value	degree Celsius	1		Temperature of the air at the time of sampling	20 degree Celsius						false			string			MIXS:0000124			air temperature	
air_temp_regm		air temperature regimen		temperature value;treatment interval and duration	meter	m		Information about treatment involving an exposure to varying temperatures; should include the temperature, treatment regimen including how many times the treatment was repeated, how long each treatment lasted, and the start and end time of the entire treatment; can include different temperature regimens	25 degree Celsius;R2/2018-05-11T14:30/2018-05-11T19:30/P1H30M						false			string			MIXS:0000551	{float} {unit};{Rn/start_time/end_time/duration}		air temperature regimen	
al_sat		extreme_unusual_properties/Al saturation		measurement value	percentage	1		Aluminum saturation (esp. For tropical soils)							false			string			MIXS:0000607			extreme_unusual_properties/Al saturation	
al_sat_meth		extreme_unusual_properties/Al saturation method		PMID,DOI or URL		1		Reference or method used in determining Al saturation							false			string			MIXS:0000324	{PMID}|{DOI}|{URL}		extreme_unusual_properties/Al saturation method	
alkalinity		alkalinity		measurement value	milliequivalent per liter, milligram per liter	1		Alkalinity, the ability of a solution to neutralize acids to the equivalence point of carbonate or bicarbonate	50 milligram per liter						false			string			MIXS:0000421			alkalinity	
alkalinity_method		alkalinity method		description of method		1		Method used for alkalinity measurement	titration						false			string			MIXS:0000298	{text}		alkalinity method	
alkyl_diethers		alkyl diethers		measurement value	mole per liter	1		Concentration of alkyl diethers	0.005 mole per liter						false			string			MIXS:0000490			alkyl diethers	
alt		altitude		measurement value				Altitude is a term used to identify heights of objects such as airplanes, space shuttles, rockets, atmospheric balloons and heights of places such as atmospheric layers and clouds. It is used to measure the height of an object which is above the earth's surface. In this context, the altitude measurement is the vertical distance between the earth's surface above sea level and the sampled position in the air	100 meter						false			string			MIXS:0000094			altitude	
aminopept_act		aminopeptidase activity		measurement value	mole per liter per hour	1		Measurement of aminopeptidase activity	0.269 mole per liter per hour						false			string			MIXS:0000172			aminopeptidase activity	
ammonium		ammonium		measurement value	micromole per liter, milligram per liter, parts per million	1		Concentration of ammonium in the sample	1.5 milligram per liter						false			string			MIXS:0000427			ammonium	
ammonium_nitrogen		ammonium_nitrogen|NH4-N		measurement value	mg/kg	1		Concentration of ammonium nitrogen in the sample	2.3 mg/kg						false			string						ammonium nitrogen	
amount_light		amount of light		measurement value	lux, lumens per square meter	1		The unit of illuminance and luminous emittance, measuring luminous flux per unit area							false			string			MIXS:0000140			amount of light	
analysis_type								Select all the data types associated or available for this biosample	metagenomics; metabolomics; proteomics						true			analysis_type_enum	true					analysis/data type	
ances_data		ancestral data		free text		1		Information about either pedigree or other ancestral information description (e.g. parental variety in case of mutant or selection), e.g. A/3*B (meaning [(A x B) x B] x B)	A/3*B						false			string			MIXS:0000247	{text}		ancestral data	
annual_precpt		mean annual precipitation		measurement value	millimeter	1		The average of all annual precipitation values known, or an estimated equivalent value derived by such methods as regional indexes or Isohyetal maps.							false			string			MIXS:0000644			mean annual precipitation	
annual_temp		mean annual temperature		measurement value	degree Celsius	1		Mean annual temperature	12.5 degree Celsius						false			string			MIXS:0000642			mean annual temperature	
antibiotic_regm		antibiotic regimen		antibiotic name;antibiotic amount;treatment interval and duration	milligram	m		Information about treatment involving antibiotic administration; should include the name of antibiotic, amount administered, treatment regimen including how many times the treatment was repeated, how long each treatment lasted, and the start and end time of the entire treatment; can include multiple antibiotic regimens	penicillin;5 milligram;R2/2018-05-11T14:30/2018-05-11T19:30/P1H30M						false			string			MIXS:0000553	{text};{float} {unit};{Rn/start_time/end_time/duration}		antibiotic regimen	
api		API gravity		measurement value	degrees API	1		API gravity is a measure of how heavy or light a petroleum liquid is compared to water (source: https://en.wikipedia.org/wiki/API_gravity) (e.g. 31.1¬∞ API)							false			string			MIXS:0000157			API gravity	
arch_struc		architectural structure		enumeration		1		An architectural structure is a human-made, free-standing, immobile outdoor construction	shed						false			arch_struc_enum			MIXS:0000774			architectural structure	
aromatics_pc		aromatics wt%		name;measurement value	percent	1		Saturate, Aromatic, Resin and Asphaltene¬†(SARA) is an analysis method that divides¬†crude oil¬†components according to their polarizability and polarity. There are three main methods to obtain SARA results. The most popular one is known as the Iatroscan TLC-FID and is referred to as IP-143 (source: https://en.wikipedia.org/wiki/Saturate,_aromatic,_resin_and_asphaltene)							false			string			MIXS:0000133	{text};{float} {unit}		aromatics wt%	
asphaltenes_pc		asphaltenes wt%		name;measurement value	percent	1		Saturate, Aromatic, Resin and Asphaltene¬†(SARA) is an analysis method that divides¬†crude oil¬†components according to their polarizability and polarity. There are three main methods to obtain SARA results. The most popular one is known as the Iatroscan TLC-FID and is referred to as IP-143 (source: https://en.wikipedia.org/wiki/Saturate,_aromatic,_resin_and_asphaltene)							false			string			MIXS:0000135	{text};{float} {unit}		asphaltenes wt%	
atmospheric_data		atmospheric data		atmospheric data name;measurement value		m		Measurement of atmospheric data; can include multiple data	wind speed;9 knots						false			string			MIXS:0001097	{text};{float} {unit}		atmospheric data	
avg_dew_point		average dew point		measurement value	degree Celsius	1		The average of dew point measures taken at the beginning of every hour over a 24 hour period on the sampling day	25.5 degree Celsius						false			string			MIXS:0000141			average dew point	
avg_occup		average daily occupancy		value		1		Daily average occupancy of room. Indicate the number of person(s) daily occupying the sampling room.	2						false			string			MIXS:0000775			average daily occupancy	
avg_temp		average temperature		measurement value	degree Celsius	1		The average of temperatures taken at the beginning of every hour over a 24 hour period on the sampling day	12.5 degree Celsius						false			string			MIXS:0000142			average temperature	
bac_prod		bacterial production		measurement value	milligram per cubic meter per day	1		Bacterial production in the water column measured by isotope uptake	5 milligram per cubic meter per day						false			string			MIXS:0000683			bacterial production	
bac_resp		bacterial respiration		measurement value	milligram per cubic meter per day, micromole oxygen per liter per hour	1		Measurement of bacterial respiration in the water column	300 micromole oxygen per liter per hour						false			string			MIXS:0000684			bacterial respiration	
bacteria_carb_prod		bacterial carbon production		measurement value	nanogram per hour	1		Measurement of bacterial carbon production	2.53 microgram per liter per hour						false			string			MIXS:0000173			bacterial carbon production	
barometric_press		barometric pressure		measurement value	millibar	1		Force per unit area exerted against a surface by the weight of air above that surface	5 millibar						false			string			MIXS:0000096			barometric pressure	
basin		basin name		name		1		Name of the basin (e.g. Campos)							false			string			MIXS:0000290	{text}		basin name	
bathroom_count		bathroom count		value		1		The number of bathrooms in the building	1						false			string			MIXS:0000776			bathroom count	
bedroom_count		bedroom count		value		1		The number of bedrooms in the building	2						false			string			MIXS:0000777			bedroom count	
benzene		benzene		measurement value	milligram per liter, parts per million	1		Concentration of benzene in the sample							false			string			MIXS:0000153			benzene	
biochem_oxygen_dem		biochemical oxygen demand		measurement value	milligram per liter	1		Amount of dissolved oxygen needed by aerobic biological organisms in a body of water to break down organic material present in a given water sample at certain temperature over a specific time period							false			string			MIXS:0000653			biochemical oxygen demand	
biocide		biocide administration		name;name;timestamp		1		List of biocides (commercial name of product and supplier) and date of administration	ALPHA 1427;Baker Hughes;2008-01-23						false			string			MIXS:0001011	{text};{text};{timestamp}		biocide administration	
biocide_admin_method		biocide administration method		measurement value;frequency;duration;duration	milligram per liter	1		Method of biocide administration (dose, frequency, duration, time elapsed between last biociding and sampling) (e.g. 150 mg/l; weekly; 4 hr; 3 days)							false			string			MIXS:0000456	{float} {unit};{Rn/start_time/end_time/duration};{duration}		biocide administration method	
biol_stat		biological status		enumeration		1		The level of genome modification.	natural						false			biol_stat_enum			MIXS:0000858			biological status	
biomass		biomass		biomass type;measurement value	ton, kilogram, gram	m		Amount of biomass; should include the name for the part of biomass measured, e.g. Microbial, total. Can include multiple measurements	total;20 gram						false			string			MIXS:0000174	{text};{float} {unit}		biomass	
biotic_regm		biotic regimen		free text		1		Information about treatment(s) involving use of biotic factors, such as bacteria, viruses or fungi.	sample inoculated with Rhizobium spp. Culture						false			string			MIXS:0001038	{text}		biotic regimen	
biotic_relationship		observed biotic relationship		enumeration				Description of relationship(s) between the subject organism and other organism(s) it is associated with. E.g., parasite on species X; mutualist with species Y. The target organism is the subject of the relationship, and the other organism(s) is the object	free living						false			biotic_relationship_enum			MIXS:0000028			observed biotic relationship	
bishomohopanol		bishomohopanol		measurement value	microgram per liter, microgram per gram	1		Concentration of bishomohopanol	14 microgram per liter						false			string			MIXS:0000175			bishomohopanol	
blood_press_diast		host blood pressure diastolic		measurement value	millimeter mercury	1		Resting diastolic blood pressure, measured as mm mercury							false			string			MIXS:0000258			host blood pressure diastolic	
blood_press_syst		host blood pressure systolic		measurement value	millimeter mercury	1		Resting systolic blood pressure, measured as mm mercury							false			string			MIXS:0000259			host blood pressure systolic	
bromide		bromide		measurement value	parts per million	1		Concentration of bromide	0.05 parts per million						false			string			MIXS:0000176			bromide	
build_docs		design, construction, and operation documents		enumeration		1		The building design, construction and operation documents	maintenance plans						false			build_docs_enum			MIXS:0000787			design, construction, and operation documents	
build_occup_type		building occupancy type		enumeration		m		The primary function for which a building or discrete part of a building is intended to be used	market						true			build_occup_type_enum			MIXS:0000761			building occupancy type	
building_setting		building setting		enumeration		1		A location (geography) where a building is set	rural						false			building_setting_enum			MIXS:0000768			building setting	
built_struc_age		built structure age		value	year	1		The age of the built structure since construction	15						false			string			MIXS:0000145			built structure age	
built_struc_set		built structure setting		enumeration		1		The characterization of the location of the built structure as high or low human density	rural						false			string			MIXS:0000778	[urban|rural]		built structure setting	
built_struc_type		built structure type		free text		1		A physical structure that is a body or assemblage of bodies in space to form a system capable of supporting loads							false			string			MIXS:0000721	{text}		built structure type	
calcium		calcium		measurement value	milligram per liter, micromole per liter, parts per million	1		Concentration of calcium in the sample	0.2 micromole per liter						false			string			MIXS:0000432			calcium	
carb_dioxide		carbon dioxide		measurement value	micromole per liter, parts per million	1		Carbon dioxide (gas) amount or concentration at the time of sampling	410 parts per million						false			string			MIXS:0000097			carbon dioxide	
carb_monoxide		carbon monoxide		measurement value	micromole per liter, parts per million	1		Carbon monoxide (gas) amount or concentration at the time of sampling	0.1 parts per million						false			string			MIXS:0000098			carbon monoxide	
carb_nitro_ratio		carbon/nitrogen ratio		measurement value		1		Ratio of amount or concentrations of carbon to nitrogen	0.417361111						false			string			MIXS:0000310			carbon/nitrogen ratio	
ceil_area		ceiling area		measurement value	square meter	1		The area of the ceiling space within the room	25 square meter						false			string			MIXS:0000148			ceiling area	
ceil_cond		ceiling condition		enumeration		1		The physical condition of the ceiling at the time of sampling; photos or video preferred; use drawings to indicate location of damaged areas	damaged						false			ceil_cond_enum			MIXS:0000779			ceiling condition	
ceil_finish_mat		ceiling finish material		enumeration		1		The type of material used to finish a ceiling	stucco						false			ceil_finish_mat_enum			MIXS:0000780			ceiling finish material	
ceil_struc		ceiling structure		enumeration		1		The construction format of the ceiling	concrete						false			string			MIXS:0000782	[wood frame|concrete]		ceiling structure	
ceil_texture		ceiling texture		enumeration		1		The feel, appearance, or consistency of a ceiling surface	popcorn						false			ceil_texture_enum			MIXS:0000783			ceiling texture	
ceil_thermal_mass		ceiling thermal mass		measurement value	joule per degree Celsius	1		The ability of the ceiling to provide inertia against temperature fluctuations. Generally this means concrete that is exposed. A metal deck that supports a concrete slab will act thermally as long as it is exposed to room air flow							false			string			MIXS:0000143			ceiling thermal mass	
ceil_type		ceiling type		enumeration		1		The type of ceiling according to the ceiling's appearance or construction	coffered						false			ceil_type_enum			MIXS:0000784			ceiling type	
ceil_water_mold		ceiling signs of water/mold		enumeration		1		Signs of the presence of mold or mildew on the ceiling	presence of mold visible						false			string			MIXS:0000781	[presence of mold visible|no presence of mold visible]		ceiling signs of water/mold	
chem_administration		chemical administration		CHEBI;timestamp		m		List of chemical compounds administered to the host or site where sampling occurred, and when (e.g. Antibiotics, n fertilizer, air filter); can include multiple compounds. For chemical entities of biological interest ontology (chebi) (v 163), http://purl.bioontology.org/ontology/chebi	agar [CHEBI:2509];2018-05-11T20:00Z						false			string			MIXS:0000751	{termLabel} {[termID]};{timestamp}		chemical administration	
chem_mutagen		chemical mutagen		mutagen name;mutagen amount;treatment interval and duration	milligram per liter	m		Treatment involving use of mutagens; should include the name of mutagen, amount administered, treatment regimen including how many times the treatment was repeated, how long each treatment lasted, and the start and end time of the entire treatment; can include multiple mutagen regimens	nitrous acid;0.5 milligram per liter;R2/2018-05-11T14:30/2018-05-11T19:30/P1H30M						false			string			MIXS:0000555	{text};{float} {unit};{Rn/start_time/end_time/duration}		chemical mutagen	
chem_oxygen_dem		chemical oxygen demand		measurement value	milligram per liter	1		A measure of the capacity of water to consume oxygen during the decomposition of organic matter and the oxidation of inorganic chemicals such as ammonia and nitrite							false			string			MIXS:0000656			chemical oxygen demand	
chem_treat_method		chemical treatment method		measurement value;frequency;duration;duration	milligram per liter	1		Method of chemical administration(dose, frequency, duration, time elapsed between administration and sampling) (e.g. 50 mg/l; twice a week; 1 hr; 0 days)							false			string			MIXS:0000457	{float} {unit};{Rn/start_time/end_time/duration};{duration};{duration}		chemical treatment method	
chem_treatment		chemical treatment		name;name;timestamp		1		List of chemical compounds administered upstream the sampling location where sampling occurred (e.g. Glycols, H2S scavenger, corrosion and scale inhibitors, demulsifiers, and other production chemicals etc.). The commercial name of the product and name of the supplier should be provided. The date of administration should also be included	ACCENT 1125;DOW;2010-11-17						false			string			MIXS:0001012	{text};{text};{timestamp}		chemical treatment	
chloride		chloride		measurement value	milligram per liter, parts per million	1		Concentration of chloride in the sample	5000 milligram per liter						false			string			MIXS:0000429			chloride	
chlorophyll		chlorophyll		measurement value	milligram per cubic meter, microgram per liter	1		Concentration of chlorophyll	5 milligram per cubic meter						false			string			MIXS:0000177			chlorophyll	
climate_environment		climate environment		climate name;treatment interval and duration		m		Treatment involving an exposure to a particular climate; treatment regimen including how many times the treatment was repeated, how long each treatment lasted, and the start and end time of the entire treatment; can include multiple climates	tropical climate;R2/2018-05-11T14:30/2018-05-11T19:30/P1H30M						false			string			MIXS:0001040	{text};{Rn/start_time/end_time/duration}		climate environment	
collection_date		collection date		date and time				The time of sampling, either as an instance (single point in time) or interval. In case no exact time is available, the date/time can be right truncated i.e. all of these are valid times: 2008-01-23T19:23:10+00:00; 2008-01-23T19:23:10; 2008-01-23; 2008-01; 2008; Except: 2008-01; 2008 all are ISO8601 compliant	2018-05-11T10:00:00+01:00; 2018-05-11						false			string			MIXS:0000011			collection date	
collection_date_inc							Date should be formatted as YYYY(-MM(-DD)). Ie, 2021-04-15, 2021-04 and 2021 are all acceptable.	Date the incubation was harvested/collected/ended. Only relevant for incubation samples.	2021-04-15, 2021-04 and 2021 are all acceptable.							MIxS collection_date accepts (truncated) ISO8601. DH taking arbitrary precision date only			true			{date, arbitrary precision}		incubation collection date	
